{
  "$schema": "http://json-schema.org/draft-07/schema#",
  "title": "EGP_LoveLedger_Unified",
  "type": "object",
  "properties": {
    "operation": {
      "type": "string",
      "enum": ["sense", "propose", "adopt"],
      "description": "EGP system call type"
    },
    "timestamp": {
      "type": "string",
      "format": "date-time",
      "description": "ISO 8601 timestamp"
    },
    "agent": {
      "type": "string",
      "description": "DID or community ID",
      "examples": ["did:example:elder", "baz:navajo"]
    },
    "location": {
      "type": "object",
      "properties": {
        "gps": { "type": "string" },
        "community_id": { "type": "string" }
      }
    },
    "content": {
      "type": "object",
      "properties": {
        "description": { "type": "string" },
        "evidence": {
          "type": "array",
          "items": { "type": "string" },
          "description": "Photos, voice notes, sensor data"
        }
      }
    },
    "care_metrics": {
      "type": "object",
      "properties": {
        "act_type": {
          "type": "string",
          "enum": ["childcare", "elders", "ecological"]
        },
        "hours": { "type": "number" },
        "impact_score": {
          "type": "number",
          "minimum": 1,
          "maximum": 5
        }
      }
    },
    "currency_alloc": {
      "type": "object",
      "properties": {
        "hearts": { "type": "number" },
        "leaves": { 
          "type": "object",
          "properties": {
            "amount": { "type": "number" },
            "nft_metadata": { 
              "type": "object",
              "properties": {
                "gps": { "type": "string" },
                "eco_act": { "type": "string" }
              }
            }
          }
        }
      }
    },
    "aubi_integration": {
      "type": "object",
      "properties": {
        "layer": {
          "type": "integer",
          "description": "AUBI payout layer (1-4)",
          "minimum": 1,
          "maximum": 4
        },
        "sunset_clause": {
          "type": "string",
          "description": "ISO 8601 duration (e.g., P6M)"
        }
      }
    }
  },
  "required": ["operation", "timestamp", "agent"]
}
